5333	1	2020-01-23T21:15Z	CVE-2015-5333	-	http://packetstormsecurity.com/files/133998/Qualys-Security-Advisory-LibreSSL-Leak-Overflow.html
5745	1	2020-01-23T20:15Z	CVE-2015-5745	-	http://www.openwall.com/lists/oss-security/2015/08/06/5
6591	1	2020-01-15T19:15Z	CVE-2015-6591	-	http://packetstormsecurity.com/files/134081/articleFR-3.0.7-Arbitrary-File-Read.html
6497	1	2020-01-15T17:15Z	CVE-2015-6497	-	http://blog.mindedsecurity.com/2015/09/autoloaded-file-inclusion-in-magento.html
6497	2	2020-01-15T17:15Z	CVE-2015-6497	-	http://karmainsecurity.com/KIS-2015-04
6497	3	2020-01-15T17:15Z	CVE-2015-6497	-	http://packetstormsecurity.com/files/133544/Magento-1.9.2-File-Inclusion.html
6497	4	2020-01-15T17:15Z	CVE-2015-6497	-	http://seclists.org/fulldisclosure/2015/Sep/48
7874	1	2020-01-15T16:15Z	CVE-2015-7874	-	https://www.exploit-db.com/exploits/39119/
5484	1	2020-01-15T16:15Z	CVE-2015-5484	-	http://seclists.org/fulldisclosure/2015/Jul/68
5466	1	2020-01-15T16:15Z	CVE-2015-5466	-	http://packetstormsecurity.com/files/133400/XGI-Windows-VGA-Display-Manager-Privilege-Escalation.html
5466	2	2020-01-15T16:15Z	CVE-2015-5466	-	http://seclists.org/fulldisclosure/2015/Sep/2
5466	3	2020-01-15T16:15Z	CVE-2015-5466	-	https://www.korelogic.com/Resources/Advisories/KL-001-2015-004.txt
7556	1	2020-01-15T15:15Z	CVE-2015-7556	-	http://seclists.org/fulldisclosure/2015/Dec/123
7556	2	2020-01-15T15:15Z	CVE-2015-7556	-	http://www.vapidlabs.com/advisory.php?v=159
2326	1	2020-01-14T17:15Z	CVE-2015-2326	-	https://bugs.exim.org/show_bug.cgi?id=1592
2325	1	2020-01-14T17:15Z	CVE-2015-2325	-	https://bugs.exim.org/show_bug.cgi?id=1591
0558	1	2020-01-14T17:15Z	CVE-2015-0558	-	http://packetstormsecurity.com/files/129817/Pirelli-Router-P.DG-A4001N-WPA-Key-Reverse-Engineering.html
4553	1	2020-01-06T21:15Z	CVE-2015-4553	-	http://seclists.org/fulldisclosure/2015/Jun/47
4553	2	2020-01-06T21:15Z	CVE-2015-4553	-	https://www.exploit-db.com/exploits/37423/
4039	1	2020-01-06T19:15Z	CVE-2015-4039	WordPress 用 WP Membership プラグインにおけるクロスサイトスクリプティングの脆弱性	http://packetstormsecurity.com/files/132011/WordPress-WP-Membership-1.2.3-Cross-Site-Scripting.html
4039	2	2020-01-06T19:15Z	CVE-2015-4039	WordPress 用 WP Membership プラグインにおけるクロスサイトスクリプティングの脆弱性	https://www.exploit-db.com/exploits/37074/
9540	1	2020-01-04T07:15Z	CVE-2015-9540	Chamilo LMS におけるオープンリダイレクトの脆弱性	https://support.chamilo.org/projects/1/wiki/Security_issues#Issue-18-2015-05-02-Low-Moderate-risk-URL-hijackingspoofing
5595	1	2019-12-31T21:15Z	CVE-2015-5595	Zenphoto におけるクロスサイトリクエストフォージェリの脆弱性	http://www.openwall.com/lists/oss-security/2015/07/18/3
5593	1	2019-12-31T21:15Z	CVE-2015-5593	Zenphoto におけるクロスサイトスクリプティングの脆弱性	http://www.openwall.com/lists/oss-security/2015/07/18/3
5592	1	2019-12-31T21:15Z	CVE-2015-5592	Zenphoto におけるクロスサイトスクリプティングの脆弱性	http://packetstormsecurity.com/files/132667/ZenPhoto-1.4.8-XSS-SQL-Injection-Traversal.html
5591	1	2019-12-31T21:15Z	CVE-2015-5591	Zenphoto における SQL インジェクションの脆弱性	http://packetstormsecurity.com/files/132667/ZenPhoto-1.4.8-XSS-SQL-Injection-Traversal.html
7892	1	2019-12-09T20:15Z	CVE-2015-7892	Samsung m2m1shot ドライバフレームワークにおける境界外書き込みに関する脆弱性	http://packetstormsecurity.com/files/134108/Samsung-M2m1shot-Kernel-Driver-Buffer-Overflow.html
3425	1	2019-12-09T20:15Z	CVE-2015-3425	Accentis Content Resource Management System におけるクロスサイトスクリプティングの脆弱性	http://packetstormsecurity.com/files/134177/Accentis-Content-Resource-Management-System-Cross-Site-Scripting.html
3424	1	2019-12-09T20:15Z	CVE-2015-3424	Accentis Content Resource Management System における SQL インジェクションの脆弱性	http://packetstormsecurity.com/files/134176/Accentis-Content-Resource-Management-System-SQL-Injection.html
7892	2	2019-12-09T20:15Z	CVE-2015-7892	Samsung m2m1shot ドライバフレームワークにおける境界外書き込みに関する脆弱性	https://code.google.com/p/google-security-research/issues/detail?id=493
7892	3	2019-12-09T20:15Z	CVE-2015-7892	Samsung m2m1shot ドライバフレームワークにおける境界外書き込みに関する脆弱性	https://www.exploit-db.com/exploits/38555/
2060	1	2019-11-29T21:15Z	CVE-2015-2060	cabextract におけるパストラバーサルの脆弱性	http://www.openwall.com/lists/oss-security/2015/02/18/3
9539	1	2019-11-26T15:15Z	CVE-2015-9539	WordPress 用 Fast Secure Contact Form プラグインにおけるクロスサイトスクリプティングの脆弱性	https://github.com/cybersecurityworks/Disclosed/issues/4
9538	1	2019-11-26T15:15Z	CVE-2015-9538	WordPress 用 NextGEN Gallery プラグインにおけるパストラバーサルの脆弱性	https://cxsecurity.com/issue/WLB-2015080165
9537	1	2019-11-26T15:15Z	CVE-2015-9537	WordPress 用 NextGEN Gallery プラグインにおけるクロスサイトスクリプティングの脆弱性	https://github.com/cybersecurityworks/Disclosed/issues/1
9539	2	2019-11-26T15:15Z	CVE-2015-9539	WordPress 用 Fast Secure Contact Form プラグインにおけるクロスサイトスクリプティングの脆弱性	https://www.openwall.com/lists/oss-security/2015/10/27/2
9538	2	2019-11-26T15:15Z	CVE-2015-9538	WordPress 用 NextGEN Gallery プラグインにおけるパストラバーサルの脆弱性	https://github.com/cybersecurityworks/Disclosed/issues/2
9537	2	2019-11-26T15:15Z	CVE-2015-9537	WordPress 用 NextGEN Gallery プラグインにおけるクロスサイトスクリプティングの脆弱性	https://www.openwall.com/lists/oss-security/2015/10/27/4
9538	3	2019-11-26T15:15Z	CVE-2015-9538	WordPress 用 NextGEN Gallery プラグインにおけるパストラバーサルの脆弱性	https://packetstormsecurity.com/files/135114/WordPress-NextGEN-Gallery-2.1.15-Cross-Site-Scripting-Path-Traversal.html
9538	4	2019-11-26T15:15Z	CVE-2015-9538	WordPress 用 NextGEN Gallery プラグインにおけるパストラバーサルの脆弱性	https://www.openwall.com/lists/oss-security/2015/08/28/4
7810	1	2019-11-22T15:15Z	CVE-2015-7810	libbluray MountManager におけるTime-of-check Time-of-use (TOCTOU) 競合状態の脆弱性	https://bugzilla.redhat.com/show_bug.cgi?id=CVE-2015-7810
2793	1	2019-11-21T20:15Z	CVE-2015-2793	ikiwiki におけるクロスサイトスクリプティングの脆弱性	https://ikiwiki.info/bugs/XSS_Alert...__33____33____33__/
8980	1	2019-11-04T21:15Z	CVE-2015-8980	php-gettext における入力確認に関する脆弱性	http://seclists.org/fulldisclosure/2016/Aug/76
9504	1	2019-10-23T17:15Z	CVE-2015-9504	WordPress 用 weeklynews テーマにおけるクロスサイトスクリプティングの脆弱性	https://wpvulndb.com/vulnerabilities/7957
9500	1	2019-10-22T21:15Z	CVE-2015-9500	WordPress 用 Exquisite Ultimate Newspaper テーマにおけるクロスサイトスクリプティングの脆弱性	https://packetstormsecurity.com/files/131657/
9499	1	2019-10-22T21:15Z	CVE-2015-9499	WordPress 用 Showbiz Pro プラグインにおける危険なタイプのファイルの無制限アップロードに関する脆弱性	https://github.com/espreto/wpsploit/blob/master/modules/exploits/unix/webapp/wp_showbiz_file_upload.rb
9497	1	2019-10-22T21:15Z	CVE-2015-9497	WordPress 用 ad-inserter プラグインにおけるクロスサイトリクエストフォージェリの脆弱性	https://packetstormsecurity.com/files/131798/
9496	1	2019-10-22T21:15Z	CVE-2015-9496	WordPress 用 freshmail-newsletter プラグインにおける SQL インジェクションの脆弱性	https://wpvulndb.com/vulnerabilities/7972
9499	2	2019-10-22T21:15Z	CVE-2015-9499	WordPress 用 Showbiz Pro プラグインにおける危険なタイプのファイルの無制限アップロードに関する脆弱性	https://wpvulndb.com/vulnerabilities/7955
9496	2	2019-10-22T21:15Z	CVE-2015-9496	WordPress 用 freshmail-newsletter プラグインにおける SQL インジェクションの脆弱性	https://www.exploit-db.com/exploits/36942
9499	3	2019-10-22T21:15Z	CVE-2015-9499	WordPress 用 Showbiz Pro プラグインにおける危険なタイプのファイルの無制限アップロードに関する脆弱性	https://www.exploit-db.com/exploits/35385
9495	1	2019-10-22T20:15Z	CVE-2015-9495	WordPress 用 syndication-links プラグインにおけるクロスサイトスクリプティングの脆弱性	https://wpvulndb.com/vulnerabilities/7981
9494	1	2019-10-22T20:15Z	CVE-2015-9494	WordPress 用 indieweb-post-kinds プラグインにおけるクロスサイトスクリプティングの脆弱性	https://wpvulndb.com/vulnerabilities/7982
9492	1	2019-10-11T19:15Z	CVE-2015-9492	WordPress 用 ThemeMakers SmartIT Premium Responsive テーマにおける情報漏えいに関する脆弱性	https://packetstormsecurity.com/files/131957/
9491	1	2019-10-11T19:15Z	CVE-2015-9491	WordPress 用 ThemeMakers Blessing Premium Responsive テーマにおける情報漏えいに関する脆弱性	https://packetstormsecurity.com/files/131957/
9490	1	2019-10-11T19:15Z	CVE-2015-9490	WordPress 用 ThemeMakers GamesTheme Premium テーマにおける情報漏えいに関する脆弱性	https://packetstormsecurity.com/files/131957/
9489	1	2019-10-11T19:15Z	CVE-2015-9489	WordPress 用 ThemeMakers Goodnex Premium Responsive テーマにおける情報漏えいに関する脆弱性	https://packetstormsecurity.com/files/131957/
9488	1	2019-10-11T19:15Z	CVE-2015-9488	WordPress 用 Almera Responsive Portfolio Site Template コンポーネントにおける情報漏えいに関する脆弱性	https://packetstormsecurity.com/files/131957/
9487	1	2019-10-11T19:15Z	CVE-2015-9487	WordPress 用 Almera Responsive Portfolio テーマにおける情報漏えいに関する脆弱性	https://packetstormsecurity.com/files/131957/
9486	1	2019-10-11T19:15Z	CVE-2015-9486	WordPress 用 Axioma Premium Responsive テーマにおける情報漏えいに関する脆弱性	https://packetstormsecurity.com/files/131957/
9485	1	2019-10-11T18:15Z	CVE-2015-9485	WordPress 用 Accio Responsive Parallax One Page Site Template コンポーネントにおける情報漏えいに関する脆弱性	https://packetstormsecurity.com/files/131957/
9484	1	2019-10-11T18:15Z	CVE-2015-9484	WordPress 用 Accio One Page Parallax Responsive テーマにおける情報漏えいに関する脆弱性	https://packetstormsecurity.com/files/131957/
9483	1	2019-10-11T18:15Z	CVE-2015-9483	WordPress 用 Invento Responsive Gallery/Architecture Template コンポーネントにおける情報漏えいに関する脆弱性	https://packetstormsecurity.com/files/131957/
9482	1	2019-10-11T18:15Z	CVE-2015-9482	WordPress 用 ThemeMakers Car Dealer / Auto Dealer Responsive テーマにおける情報漏えいに関する脆弱性	https://packetstormsecurity.com/files/131957/
9481	1	2019-10-11T18:15Z	CVE-2015-9481	WordPress 用 ThemeMakers Diplomat | Political テーマにおける情報漏えいに関する脆弱性	https://packetstormsecurity.com/files/131957/
9480	1	2019-10-10T17:15Z	CVE-2015-9480	WordPress 用 RobotCPA プラグインにおけるパストラバーサルの脆弱性	https://www.exploit-db.com/exploits/37252
9479	1	2019-10-10T17:15Z	CVE-2015-9479	WordPress 用 ACF-Frontend-Display プラグインにおける危険なタイプのファイルの無制限アップロードに関する脆弱性	https://packetstormsecurity.com/files/132590/
9475	1	2019-10-10T17:15Z	CVE-2015-9475	WordPress 用 Pont テーマにおける不適切なデフォルトパーミッションに関する脆弱性	https://wpvulndb.com/vulnerabilities/8061
9474	1	2019-10-10T17:15Z	CVE-2015-9474	WordPress 用 Simpolio テーマにおける不適切なデフォルトパーミッションに関する脆弱性	https://wpvulndb.com/vulnerabilities/8061
9473	1	2019-10-10T17:15Z	CVE-2015-9473	WordPress 用 estrutura-basica テーマにおけるパストラバーサルの脆弱性	https://packetstormsecurity.com/files/132042/
9470	1	2019-10-10T17:15Z	CVE-2015-9470	WordPress 用 history-collection プラグインにおけるパストラバーサルの脆弱性	https://packetstormsecurity.com/files/132279/
9469	1	2019-10-10T17:15Z	CVE-2015-9469	WordPress 用 content-grabber プラグインにおけるクロスサイトスクリプティングの脆弱性	https://packetstormsecurity.com/files/132910/
9467	1	2019-10-10T17:15Z	CVE-2015-9467	WordPress 用 broken-link-manager プラグインにおける SQL インジェクションの脆弱性	http://cinu.pl/research/wp-plugins/mail_604dd4c86dca013f6e5e89751352f36d.html
9466	1	2019-10-10T17:15Z	CVE-2015-9466	WordPress 用 wti-like-post プラグインにおける SQL インジェクションの脆弱性	http://cinu.pl/research/wp-plugins/mail_576345187f5867ec8921b12de5884fb1.html
9465	1	2019-10-10T17:15Z	CVE-2015-9465	WordPress 用 yet-another-stars-rating プラグインにおける SQL インジェクションの脆弱性	http://cinu.pl/research/wp-plugins/mail_041b796c7533880df03a43895fed5f00.html
9463	1	2019-10-10T17:15Z	CVE-2015-9463	WordPress 用 s3bubble-amazon-s3-audio-streaming プラグインにおけるパストラバーサルの脆弱性	http://packetstormsecurity.com/files/132578/
9464	1	2019-10-10T16:15Z	CVE-2015-9464	WordPress 用 s3bubble-amazon-s3-html-5-video-with-adverts プラグインにおけるパストラバーサルの脆弱性	https://www.exploit-db.com/exploits/37494
9462	1	2019-10-10T16:15Z	CVE-2015-9462	WordPress 用 awesome-filterable-portfolio プラグインにおける SQL インジェクションの脆弱性	http://cinu.pl/research/wp-plugins/mail_082287dbf7a24d415ff71581fc248330.html
9461	1	2019-10-10T16:15Z	CVE-2015-9461	WordPress 用 awesome-filterable-portfolio プラグインにおける SQL インジェクションの脆弱性	http://cinu.pl/research/wp-plugins/mail_082287dbf7a24d415ff71581fc248330.html
9460	1	2019-10-10T16:15Z	CVE-2015-9460	WordPress 用  booking-system プラグインにおける SQL インジェクションの脆弱性	http://cinu.pl/research/wp-plugins/mail_dad9a09a6290ae952bfd97010583bdbd.html
9459	1	2019-10-10T16:15Z	CVE-2015-9459	WordPress 用 searchterms-tagging-2 プラグインにおけるクロスサイトスクリプティングの脆弱性	http://cinu.pl/research/wp-plugins/mail_d14e213879cd60e80e538bde21c0359b.html
9458	1	2019-10-10T16:15Z	CVE-2015-9458	WordPress 用 searchterms-tagging-2 プラグインにおける SQL インジェクションの脆弱性	http://cinu.pl/research/wp-plugins/mail_d14e213879cd60e80e538bde21c0359b.html
9457	1	2019-10-10T16:15Z	CVE-2015-9457	WordPress 用 pretty-link プラグインにおける SQL インジェクションの脆弱性	http://cinu.pl/research/wp-plugins/mail_9ca443a3759e5c7fd889ae0e02e044e6.html
9456	1	2019-10-07T15:15Z	CVE-2015-9456	WordPress 用 orbisius-child-theme-creator プラグインにおける重要なリソースに対する不適切なパーミッションの割り当てに関する脆弱性	http://cinu.pl/research/wp-plugins/mail_28c91eee00e8e4b5868ebc58b5b1f730.html
9454	1	2019-10-07T15:15Z	CVE-2015-9454	WordPress 用 smooth-slider プラグインにおける SQL インジェクションの脆弱性	http://cinu.pl/research/wp-plugins/mail_36e814da6ac4dd903be2c77cfbdd0afd.html
9453	1	2019-10-07T15:15Z	CVE-2015-9453	WordPress 用 broken-link-manager プラグインにおけるクロスサイトスクリプティングの脆弱性	http://cinu.pl/research/wp-plugins/mail_b677bb83a6c1495f85f76faa5b13011d.html
9452	1	2019-10-07T15:15Z	CVE-2015-9452	WordPress 用 nex-forms-express-wp-form-builder プラグインにおける SQL インジェクションの脆弱性	http://cinu.pl/research/wp-plugins/mail_cb24b6204803e8e94943b198edc37af7.html
9451	1	2019-10-07T15:15Z	CVE-2015-9451	WordPress 用 plugmatter-optin-feature-box-lite プラグインにおける SQL インジェクションの脆弱性	http://cinu.pl/research/wp-plugins/mail_ec951d52aa603c9caaca8c7005b84004.html
9456	2	2019-10-07T15:15Z	CVE-2015-9456	WordPress 用 orbisius-child-theme-creator プラグインにおける重要なリソースに対する不適切なパーミッションの割り当てに関する脆弱性	https://wpvulndb.com/vulnerabilities/8315
9454	2	2019-10-07T15:15Z	CVE-2015-9454	WordPress 用 smooth-slider プラグインにおける SQL インジェクションの脆弱性	https://wpvulndb.com/vulnerabilities/8284
9453	2	2019-10-07T15:15Z	CVE-2015-9453	WordPress 用 broken-link-manager プラグインにおけるクロスサイトスクリプティングの脆弱性	https://wpvulndb.com/vulnerabilities/8333
9452	2	2019-10-07T15:15Z	CVE-2015-9452	WordPress 用 nex-forms-express-wp-form-builder プラグインにおける SQL インジェクションの脆弱性	https://wpvulndb.com/vulnerabilities/8336
9451	2	2019-10-07T15:15Z	CVE-2015-9451	WordPress 用 plugmatter-optin-feature-box-lite プラグインにおける SQL インジェクションの脆弱性	https://wpvulndb.com/vulnerabilities/8340
9448	1	2019-09-26T04:15Z	CVE-2015-9448	WordPress 用 sendpress プラグインにおける SQL インジェクションの脆弱性	http://cinu.pl/research/wp-plugins/mail_8a2f7613577ea8e613ec274aeec14527.html
9447	1	2019-09-26T04:15Z	CVE-2015-9447	WordPress 用 unite-gallery-lite プラグインにおけるクロスサイトリクエストフォージェリの脆弱性	http://packetstormsecurity.com/files/132842/
9446	1	2019-09-26T04:15Z	CVE-2015-9446	WordPress 用 unite-gallery-lite プラグインにおける SQL インジェクションの脆弱性	http://packetstormsecurity.com/files/132842/
9445	1	2019-09-26T04:15Z	CVE-2015-9445	WordPress 用 unite-gallery-lite プラグインにおけるクロスサイトリクエストフォージェリの脆弱性	http://packetstormsecurity.com/files/132842/
9444	1	2019-09-26T04:15Z	CVE-2015-9444	WordPress 用 altos-connect プラグインにおけるクロスサイトスクリプティングの脆弱性	http://packetstormsecurity.com/files/132908/
9443	1	2019-09-26T04:15Z	CVE-2015-9443	WordPress 用 accurate-form-data-real-time-form-validation プラグインにおけるクロスサイトリクエストフォージェリの脆弱性	http://packetstormsecurity.com/files/132911/
9442	1	2019-09-26T04:15Z	CVE-2015-9442	WordPress 用 avenirsoft-directdownload プラグインにおけるクロスサイトリクエストフォージェリの脆弱性	http://packetstormsecurity.com/files/132992/
9441	1	2019-09-26T04:15Z	CVE-2015-9441	WordPress 用  bookmarkify プラグインにおけるクロスサイトリクエストフォージェリの脆弱性	http://packetstormsecurity.com/files/133001/
9440	1	2019-09-26T04:15Z	CVE-2015-9440	WordPress 用 monetize プラグインにおけるクロスサイトリクエストフォージェリの脆弱性	http://packetstormsecurity.com/files/133002/
9438	1	2019-09-26T02:15Z	CVE-2015-9438	WordPress 用 display-widgets プラグインにおけるクロスサイトスクリプティングの脆弱性	http://cinu.pl/research/wp-plugins/mail_a7012199c9236754edd72786637e5d2d.html
9437	1	2019-09-26T02:15Z	CVE-2015-9437	WordPress 用 dynamic-widgets プラグインにおけるクロスサイトリクエストフォージェリの脆弱性	http://cinu.pl/research/wp-plugins/mail_489304900a50751da1495e2ea660bc51.html
9436	1	2019-09-26T02:15Z	CVE-2015-9436	WordPress 用 dynamic-widgets プラグインにおけるクロスサイトスクリプティングの脆弱性	http://cinu.pl/research/wp-plugins/mail_489304900a50751da1495e2ea660bc51.html
9434	1	2019-09-26T02:15Z	CVE-2015-9434	WordPress 用 kiwi-logo-carousel プラグインにおけるクロスサイトリクエストフォージェリの脆弱性	http://cinu.pl/research/wp-plugins/mail_3764bb40db5ed12aac2c7812d7544730.html
9433	1	2019-09-26T02:15Z	CVE-2015-9433	WordPress 用 wp-social-bookmarking-light プラグインにおけるクロスサイトリクエストフォージェリの脆弱性	http://cinu.pl/research/wp-plugins/mail_58e88633599b7b2fc0f44ce6fa7ff27d.html
9432	1	2019-09-26T02:15Z	CVE-2015-9432	WordPress 用 alpine-photo-tile-for-instagram プラグインにおけるクロスサイトリクエストフォージェリの脆弱性	http://cinu.pl/research/wp-plugins/mail_8af3902b4f3a5d06304937c7eab1ee35.html
9431	1	2019-09-26T02:15Z	CVE-2015-9431	WordPress 用 qtranslate-x プラグインにおけるクロスサイトリクエストフォージェリの脆弱性	http://cinu.pl/research/wp-plugins/mail_1a40d7e7a2c29847b939f2c7472c335e.html
9437	2	2019-09-26T02:15Z	CVE-2015-9437	WordPress 用 dynamic-widgets プラグインにおけるクロスサイトリクエストフォージェリの脆弱性	https://wpvulndb.com/vulnerabilities/8258
9436	2	2019-09-26T02:15Z	CVE-2015-9436	WordPress 用 dynamic-widgets プラグインにおけるクロスサイトスクリプティングの脆弱性	https://wpvulndb.com/vulnerabilities/8258
9434	2	2019-09-26T02:15Z	CVE-2015-9434	WordPress 用 kiwi-logo-carousel プラグインにおけるクロスサイトリクエストフォージェリの脆弱性	https://wpvulndb.com/vulnerabilities/8290
9433	2	2019-09-26T02:15Z	CVE-2015-9433	WordPress 用 wp-social-bookmarking-light プラグインにおけるクロスサイトリクエストフォージェリの脆弱性	https://wpvulndb.com/vulnerabilities/8252
9432	2	2019-09-26T02:15Z	CVE-2015-9432	WordPress 用 alpine-photo-tile-for-instagram プラグインにおけるクロスサイトリクエストフォージェリの脆弱性	https://wpvulndb.com/vulnerabilities/8268
9431	2	2019-09-26T02:15Z	CVE-2015-9431	WordPress 用 qtranslate-x プラグインにおけるクロスサイトリクエストフォージェリの脆弱性	https://wpvulndb.com/vulnerabilities/8279
9449	1	2019-09-26T01:15Z	CVE-2015-9449	WordPress 用 microblog-poster プラグインにおける SQL インジェクションの脆弱性	http://cinu.pl/research/wp-plugins/mail_642d8f7d8715d08f070a35b896f2d8bd.html
9430	1	2019-09-26T01:15Z	CVE-2015-9430	WordPress 用 crazy-bone プラグインにおけるクロスサイトスクリプティングの脆弱性	http://cinu.pl/research/wp-plugins/mail_e22c10161b1e2e4e54facf2d17e723c3.html
9429	1	2019-09-26T01:15Z	CVE-2015-9429	WordPress 用 yith-maintenance-mode プラグインにおけるクロスサイトリクエストフォージェリの脆弱性	http://cinu.pl/research/wp-plugins/mail_3a14a77571c73684103e0f517a92d757.html
9428	1	2019-09-26T01:15Z	CVE-2015-9428	WordPress 用 wplegalpages プラグインにおけるクロスサイトリクエストフォージェリの脆弱性	http://cinu.pl/research/wp-plugins/mail_4e7cf11876edb93517405b69cb033741.html
9427	1	2019-09-26T01:15Z	CVE-2015-9427	WordPress 用 googmonify プラグインにおけるクロスサイトリクエストフォージェリの脆弱性	http://packetstormsecurity.com/files/133267/
9426	1	2019-09-26T01:15Z	CVE-2015-9426	WordPress 用 manual-image-crop プラグインにおけるクロスサイトスクリプティングの脆弱性	http://cinu.pl/research/wp-plugins/mail_7c87194ce1dcf0642135d17a71ed91cd.html
9425	1	2019-09-26T01:15Z	CVE-2015-9425	WordPress 用 social-locker プラグインにおけるクロスサイトリクエストフォージェリの脆弱性	http://cinu.pl/research/wp-plugins/mail_9e26c6f71bf8467e4a5017b15d5acddc.html
9424	1	2019-09-26T01:15Z	CVE-2015-9424	WordPress 用 multicons プラグインにおけるクロスサイトリクエストフォージェリの脆弱性	http://cinu.pl/research/wp-plugins/mail_aea47a98ad3088dbb33528ded8e1b124.html
9423	1	2019-09-26T01:15Z	CVE-2015-9423	WordPress 用 PlugNedit Adaptive Editor プラグインにおけるクロスサイトスクリプティングの脆弱性	http://cinu.pl/research/wp-plugins/mail_b5405e735cb605b2fd1a300bb8be4860.html
9422	1	2019-09-26T01:15Z	CVE-2015-9422	WordPress 用 PlugNedit Adaptive Editor プラグインにおけるクロスサイトリクエストフォージェリの脆弱性	http://cinu.pl/research/wp-plugins/mail_b5405e735cb605b2fd1a300bb8be4860.html
9421	1	2019-09-26T01:15Z	CVE-2015-9421	WordPress 用 olevmedia-shortcodes プラグインにおけるクロスサイトリクエストフォージェリの脆弱性	http://cinu.pl/research/wp-plugins/mail_d9e466122cd9a6ca27db840cca277cdb.html
9420	1	2019-09-26T01:15Z	CVE-2015-9420	WordPress 用 soundcloud-is-gold プラグインにおけるクロスサイトスクリプティングの脆弱性	http://cinu.pl/research/wp-plugins/mail_9acbc3ef2dd43bfb78b6b3dcf6c5ef01.html
9419	1	2019-09-26T01:15Z	CVE-2015-9419	WordPress 用 captain-slider プラグインにおけるクロスサイトスクリプティングの脆弱性	https://packetstormsecurity.com/files/133362/
9449	2	2019-09-26T01:15Z	CVE-2015-9449	WordPress 用 microblog-poster プラグインにおける SQL インジェクションの脆弱性	https://wpvulndb.com/vulnerabilities/8321
9430	2	2019-09-26T01:15Z	CVE-2015-9430	WordPress 用 crazy-bone プラグインにおけるクロスサイトスクリプティングの脆弱性	https://wpvulndb.com/vulnerabilities/8281
9429	2	2019-09-26T01:15Z	CVE-2015-9429	WordPress 用 yith-maintenance-mode プラグインにおけるクロスサイトリクエストフォージェリの脆弱性	https://wpvulndb.com/vulnerabilities/8285
9428	2	2019-09-26T01:15Z	CVE-2015-9428	WordPress 用 wplegalpages プラグインにおけるクロスサイトリクエストフォージェリの脆弱性	https://wpvulndb.com/vulnerabilities/8291
9427	2	2019-09-26T01:15Z	CVE-2015-9427	WordPress 用 googmonify プラグインにおけるクロスサイトリクエストフォージェリの脆弱性	https://wpvulndb.com/vulnerabilities/8158
