2882	1	2017-04-10T03:59Z	CVE-2015-2882	Philips In.Sight B120/37 におけるハードコードされた認証情報の使用に関する脆弱性	https://community.rapid7.com/community/infosec/blog/2015/09/02/iotsec-disclosure-10-new-vulns-for-several-video-baby-monitors
2881	1	2017-04-10T03:59Z	CVE-2015-2881	Gynoii デバイスにおけるハードコードされた認証情報の使用に関する脆弱性	https://community.rapid7.com/community/infosec/blog/2015/09/02/iotsec-disclosure-10-new-vulns-for-several-video-baby-monitors
2880	1	2017-04-10T03:59Z	CVE-2015-2880	TRENDnet WiFi Baby Cam TV-IP743SIC における認証に関する脆弱性	https://community.rapid7.com/community/infosec/blog/2015/09/02/iotsec-disclosure-10-new-vulns-for-several-video-baby-monitors
4624	1	2017-03-31T16:59Z	CVE-2015-4624	Hak5 WiFi Pineapple におけるアクセス制御に関する脆弱性	http://packetstormsecurity.com/files/133052/WiFi-Pineapple-Predictable-CSRF-Token.html
4624	2	2017-03-31T16:59Z	CVE-2015-4624	Hak5 WiFi Pineapple におけるアクセス制御に関する脆弱性	http://packetstormsecurity.com/files/139212/Hak5-WiFi-Pineapple-Preconfiguration-Command-Injection-2.html
4624	3	2017-03-31T16:59Z	CVE-2015-4624	Hak5 WiFi Pineapple におけるアクセス制御に関する脆弱性	https://www.exploit-db.com/exploits/40609/
8309	1	2017-03-27T15:59Z	CVE-2015-8309	Cherry Music におけるディレクトリトラバーサルの脆弱性	https://www.exploit-db.com/exploits/40361/
8556	1	2017-03-24T14:59Z	CVE-2015-8556	Gentoo QEMU パッケージにおける競合状態に関する脆弱性	http://packetstormsecurity.com/files/134948/Gentoo-QEMU-Local-Privilege-Escalation.html
8556	2	2017-03-24T14:59Z	CVE-2015-8556	Gentoo QEMU パッケージにおける競合状態に関する脆弱性	https://security.gentoo.org/glsa/201602-01
8556	3	2017-03-24T14:59Z	CVE-2015-8556	Gentoo QEMU パッケージにおける競合状態に関する脆弱性	https://www.exploit-db.com/exploits/39010/
5729	1	2017-03-23T20:59Z	CVE-2015-5729	複数の Samsung Smart TV および Xpress の Soft Access Point 機能における重要な情報を取得される脆弱性	http://kaoticoneutral.blogspot.com.ar/2015/12/samsung-smarttv-and-printers-weak.html
5729	2	2017-03-23T20:59Z	CVE-2015-5729	複数の Samsung Smart TV および Xpress の Soft Access Point 機能における重要な情報を取得される脆弱性	http://packetstormsecurity.com/files/134976/Samsung-SoftAP-Weak-Password.html
3884	1	2017-03-17T14:59Z	CVE-2015-3884	qdPM の複数のページにおける任意のコードを実行される脆弱性	http://rossmarks.uk/whitepapers/qdPM_8.3.txt
3883	1	2017-03-17T14:59Z	CVE-2015-3883	qdPM におけるクロスサイトスクリプティングの脆弱性	http://rossmarks.uk/whitepapers/qdPM_8.3.txt
3882	1	2017-03-17T14:59Z	CVE-2015-3882	qdPM における重要な情報を取得される脆弱性	http://rossmarks.uk/whitepapers/qdPM_8.3.txt
3881	1	2017-03-17T14:59Z	CVE-2015-3881	qdPM における重要な情報を取得される脆弱性	http://rossmarks.uk/whitepapers/qdPM_8.3.txt
8815	1	2017-03-03T16:59Z	CVE-2015-8815	Umbraco におけるクロスサイトスクリプティングの脆弱性	http://issues.umbraco.org/issue/U4-7461
8813	1	2017-03-03T16:59Z	CVE-2015-8813	Umbraco の Umbraco.Web/umbraco.presentation/umbraco/dashboard/FeedProxy.aspx.cs におけるサーバサイドのリクエストフォージェリの脆弱性	http://www.openwall.com/lists/oss-security/2016/02/17/5
8994	1	2017-03-02T06:59Z	CVE-2015-8994	PHP におけるスクリプトファイルのアクセス権を無効にされる脆弱性	https://bugs.php.net/bug.php?id=69090
8994	2	2017-03-02T06:59Z	CVE-2015-8994	PHP におけるスクリプトファイルのアクセス権を無効にされる脆弱性	https://ma.ttias.be/a-better-way-to-run-php-fpm/
8903	1	2017-02-27T22:59Z	CVE-2015-8903	ImageMagick の coders/vicar.c の ReadVICARImage 関数におけるサービス運用妨害 (DoS) の脆弱性	http://www.imagemagick.org/discourse-server/viewtopic.php?f=3&t=26933
8902	1	2017-02-27T22:59Z	CVE-2015-8902	ImageMagick の coders/pdb.c の ReadBlobByte 関数におけるサービス運用妨害 (DoS) の脆弱性	http://www.imagemagick.org/discourse-server/viewtopic.php?f=3&t=26932
8901	1	2017-02-27T22:59Z	CVE-2015-8901	ImageMagick におけるサービス運用妨害 (DoS) の脆弱性	http://www.imagemagick.org/discourse-server/viewtopic.php?f=3&t=26931
8900	1	2017-02-27T22:59Z	CVE-2015-8900	ImageMagick の coders/hdr.c の ReadHDRImage 関数におけるサービス運用妨害 (DoS) の脆弱性	http://www.imagemagick.org/discourse-server/viewtopic.php?f=3&t=26929
8979	1	2017-02-15T15:59Z	CVE-2015-8979	DICOM dcmtk の storescp の parsePresentationContext 関数におけるスタックベースのバッファオーバーフローの脆弱性	http://packetstormsecurity.com/files/140191/DCMTK-storescp-DICOM-storage-C-STORE-SCP-Remote-Stack-Buffer-Overflow.html
8979	2	2017-02-15T15:59Z	CVE-2015-8979	DICOM dcmtk の storescp の parsePresentationContext 関数におけるスタックベースのバッファオーバーフローの脆弱性	http://www.zeroscience.mk/en/vulnerabilities/ZSL-2016-5384.php
8832	1	2017-02-09T15:59Z	CVE-2015-8832	Dotclear の inc/core/class.dc.core.php における任意の PHP コードを実行される脆弱性	http://packetstormsecurity.com/files/134352/dotclear-2.8.1-Shell-Upload.html
8831	1	2017-02-09T15:59Z	CVE-2015-8831	Dotclear の admin/comments.php におけるクロスサイトスクリプティングの脆弱性	http://packetstormsecurity.com/files/134353/dotclear-2.8.1-Cross-Site-Scripting.html
6023	1	2017-02-09T15:59Z	CVE-2015-6023	NetCommWireless HSPA 3G10WVE Wireless Router のファームウェアの ping.cgi におけるアクセス制限を回避される脆弱性	http://packetstormsecurity.com/files/136901/NetCommWireless-HSPA-3G10WVE-Authentication-Bypass-Code-Execution.html
8832	2	2017-02-09T15:59Z	CVE-2015-8832	Dotclear の inc/core/class.dc.core.php における任意の PHP コードを実行される脆弱性	http://seclists.org/fulldisclosure/2015/Nov/58
8831	2	2017-02-09T15:59Z	CVE-2015-8831	Dotclear の admin/comments.php におけるクロスサイトスクリプティングの脆弱性	https://blog.curesec.com/article/blog/dotclear-281-XSS-94.html
6023	2	2017-02-09T15:59Z	CVE-2015-6023	NetCommWireless HSPA 3G10WVE Wireless Router のファームウェアの ping.cgi におけるアクセス制限を回避される脆弱性	http://seclists.org/fulldisclosure/2016/May/13
8832	3	2017-02-09T15:59Z	CVE-2015-8832	Dotclear の inc/core/class.dc.core.php における任意の PHP コードを実行される脆弱性	https://blog.curesec.com/article/blog/dotclear-281-Code-Execution-93.html
6023	3	2017-02-09T15:59Z	CVE-2015-6023	NetCommWireless HSPA 3G10WVE Wireless Router のファームウェアの ping.cgi におけるアクセス制限を回避される脆弱性	https://www.exploit-db.com/exploits/39762/
8608	1	2017-02-07T15:59Z	CVE-2015-8608	Perl の VDir::MapPathA および VDir::MapPathW 関数におけるサービス運用妨害 (DoS) の脆弱性	https://packetstormsecurity.com/files/136649/Perl-5.22-VDir-MapPathA-W-Out-Of-Bounds-Reads-Buffer-Over-Reads.html
5677	1	2017-02-07T15:59Z	CVE-2015-5677	FreeBSD で使用される bsnmpd における USM 認証の秘密鍵を取得される脆弱性	https://pierrekim.github.io/blog/2016-01-15-cve-2015-5677-freebsd-bsnmpd.html
8608	2	2017-02-07T15:59Z	CVE-2015-8608	Perl の VDir::MapPathA および VDir::MapPathW 関数におけるサービス運用妨害 (DoS) の脆弱性	https://rt.perl.org/Public/Bug/Display.html?id=126755
2794	1	2017-02-06T15:59Z	CVE-2015-2794	DotNetNuke のインストールウィザードにおけるアプリケーションを再インストールされる脆弱性	https://www.exploit-db.com/exploits/39777/
2181	1	2017-01-30T22:59Z	CVE-2015-2181	Roundcube の Password プラグインの DBMail ドライバにおけるバッファオーバーフローの脆弱性	https://github.com/roundcube/roundcubemail/issues/4757
2180	1	2017-01-30T22:59Z	CVE-2015-2180	Roundcube の Password プラグインの DBMail ドライバにおける任意のコマンドを実行される脆弱性	https://github.com/roundcube/roundcubemail/issues/4757
8972	1	2017-01-23T21:59Z	CVE-2015-8972	GNU Chess の frontend/move.cc の ValidateMove 関数におけるスタックベースのバッファオーバーフローの脆弱性	http://lists.gnu.org/archive/html/bug-gnu-chess/2015-10/msg00002.html
8862	1	2017-01-23T21:59Z	CVE-2015-8862	Node.js 用 mustache パッケージにおけるクロスサイトスクリプティングの脆弱性	https://nodesecurity.io/advisories/62
8858	1	2017-01-23T21:59Z	CVE-2015-8858	Node.js 用 uglify-js パッケージにおけるサービス運用妨害 (DoS) の脆弱性	https://nodesecurity.io/advisories/48
8857	1	2017-01-23T21:59Z	CVE-2015-8857	Node.js 用 uglify-js パッケージにおけるセキュリティメカニズムを回避される脆弱性	https://nodesecurity.io/advisories/39
8315	1	2017-01-23T21:59Z	CVE-2015-8315	Node.js 用 ms パッケージにおけるサービス運用妨害 (DoS) の脆弱性	https://nodesecurity.io/advisories/46
7743	1	2017-01-23T21:59Z	CVE-2015-7743	PRTG Network Monitor における XML 外部エンティティの脆弱性	https://packetstormsecurity.com/files/137255/Paessler-PRTG-Network-Monitor-14.4.12.3282-XXE-Injection.html
4626	1	2017-01-23T21:59Z	CVE-2015-4626	B.A.S C2Box におけるビジネスロジックを破損される脆弱性	https://packetstormsecurity.com/files/136450/C2Box-4.0.0-r19171-Validation-Bypass.html
4594	1	2017-01-10T15:59Z	CVE-2015-4594	eClinicalWorks Population Health におけるセッションの固定化の脆弱性	http://packetstormsecurity.com/files/135533/eClinicalWorks-Population-Health-CCMR-SQL-Injection-CSRF-XSS.html
4593	1	2017-01-10T15:59Z	CVE-2015-4593	eClinicalWorks Population Health の portalUserService.jsp におけるクロスサイトリクエストフォージェリの脆弱性	http://packetstormsecurity.com/files/135533/eClinicalWorks-Population-Health-CCMR-SQL-Injection-CSRF-XSS.html
4592	1	2017-01-10T15:59Z	CVE-2015-4592	eClinicalWorks Population Health の portalUserService.jsp における SQL インジェクションの脆弱性	http://packetstormsecurity.com/files/135533/eClinicalWorks-Population-Health-CCMR-SQL-Injection-CSRF-XSS.html
4591	1	2017-01-10T15:59Z	CVE-2015-4591	eClinicalWorks Population Health の login.jsp におけるクロスサイトスクリプティングの脆弱性	http://packetstormsecurity.com/files/135533/eClinicalWorks-Population-Health-CCMR-SQL-Injection-CSRF-XSS.html
4594	2	2017-01-10T15:59Z	CVE-2015-4594	eClinicalWorks Population Health におけるセッションの固定化の脆弱性	https://www.exploit-db.com/exploits/39402/
4593	2	2017-01-10T15:59Z	CVE-2015-4593	eClinicalWorks Population Health の portalUserService.jsp におけるクロスサイトリクエストフォージェリの脆弱性	https://www.exploit-db.com/exploits/39402/
4592	2	2017-01-10T15:59Z	CVE-2015-4592	eClinicalWorks Population Health の portalUserService.jsp における SQL インジェクションの脆弱性	http://www.securityfocus.com/archive/1/537420/100/0/threaded
4591	2	2017-01-10T15:59Z	CVE-2015-4591	eClinicalWorks Population Health の login.jsp におけるクロスサイトスクリプティングの脆弱性	http://www.securityfocus.com/archive/1/537420/100/0/threaded
4592	3	2017-01-10T15:59Z	CVE-2015-4592	eClinicalWorks Population Health の portalUserService.jsp における SQL インジェクションの脆弱性	https://www.exploit-db.com/exploits/39402/
4591	3	2017-01-10T15:59Z	CVE-2015-4591	eClinicalWorks Population Health の login.jsp におけるクロスサイトスクリプティングの脆弱性	https://www.exploit-db.com/exploits/39402/
7848	1	2017-01-06T21:59Z	CVE-2015-7848	NTP-dev. における整数オーバーフローの脆弱性	http://www.talosintelligence.com/reports/TALOS-2015-0052/
2868	1	2017-01-06T21:59Z	CVE-2015-2868	Trane ComfortLink II ファームウェアの DSS サービスにおけるリモートでコードを実行される脆弱性	http://www.talosintelligence.com/reports/TALOS-2016-0027/
2867	1	2017-01-06T21:59Z	CVE-2015-2867	Trane ComfortLink II SCC ファームウェアのサービスにおけるシステム制御権を取得される脆弱性	http://www.talosintelligence.com/reports/TALOS-2016-0028/
6574	1	2016-12-15T22:59Z	CVE-2015-6574	特定の SISCO MMS-EASE および AX-S4 ICCP 製品の SNAP Lite コンポーネントにおけるサービス運用妨害 (DoS) の脆弱性	https://www.portcullis-security.com/security-research-and-downloads/security-advisories/cve-2015-6574/
5073	1	2016-12-13T16:59Z	CVE-2015-5073	PCRE の pcre_compile.c の find_fixedlength 関数におけるヒープベースのバッファオーバーフローの脆弱性	http://vcs.pcre.org/pcre?view=revision&revision=1571
3217	1	2016-12-13T16:59Z	CVE-2015-3217	PCRE および PCRE2 におけるサービス運用妨害 (DoS) の脆弱性	https://bugs.exim.org/show_bug.cgi?id=1638
3210	1	2016-12-13T16:59Z	CVE-2015-3210	PCRE および PCRE2 におけるヒープベースのバッファオーバーフローの脆弱性	https://bugs.exim.org/show_bug.cgi?id=1636
5073	2	2016-12-13T16:59Z	CVE-2015-5073	PCRE の pcre_compile.c の find_fixedlength 関数におけるヒープベースのバッファオーバーフローの脆弱性	https://bugs.exim.org/show_bug.cgi?id=1651
1328	1	2016-11-28T03:59Z	CVE-2015-1328	Ubuntu の linux パッケージの overlayfs の実装における root アクセス権を取得される脆弱性	http://www.exploit-db.com/exploits/40688/
8969	1	2016-11-03T10:59Z	CVE-2015-8969	git-fastclone における任意のコマンドを実行される脆弱性	https://hackerone.com/reports/105190
8968	1	2016-11-03T10:59Z	CVE-2015-8968	git-fastclone における任意のシェルコマンドを実行される脆弱性	https://hackerone.com/reports/104465
8953	1	2016-10-16T21:59Z	CVE-2015-8953	Linux Kernel の fs/overlayfs/copy_up.c におけるサービス運用妨害 (DoS) の脆弱性	http://git.kernel.org/cgit/linux/kernel/git/torvalds/linux.git/commit/?id=ab79efab0a0ba01a74df782eb7fa44b044dae8b5
8953	2	2016-10-16T21:59Z	CVE-2015-8953	Linux Kernel の fs/overlayfs/copy_up.c におけるサービス運用妨害 (DoS) の脆弱性	http://www.openwall.com/lists/oss-security/2016/08/23/9
5162	1	2016-10-07T14:59Z	CVE-2015-5162	複数の OpenStack 製品のイメージパーサにおけるサービス運用妨害 (DoS) の脆弱性	https://launchpad.net/bugs/1449062
2080	1	2016-10-07T14:59Z	CVE-2015-2080	Eclipse Jetty の例外処理コードにおけるプロセスメモリから重要な情報を取得される脆弱性	http://packetstormsecurity.com/files/130567/Jetty-9.2.8-Shared-Buffer-Leakage.html
2080	2	2016-10-07T14:59Z	CVE-2015-2080	Eclipse Jetty の例外処理コードにおけるプロセスメモリから重要な情報を取得される脆弱性	http://seclists.org/fulldisclosure/2015/Mar/12
2080	3	2016-10-07T14:59Z	CVE-2015-2080	Eclipse Jetty の例外処理コードにおけるプロセスメモリから重要な情報を取得される脆弱性	https://blog.gdssecurity.com/labs/2015/2/25/jetleak-vulnerability-remote-leakage-of-shared-buffers-in-je.html
2080	4	2016-10-07T14:59Z	CVE-2015-2080	Eclipse Jetty の例外処理コードにおけるプロセスメモリから重要な情報を取得される脆弱性	https://github.com/eclipse/jetty.project/blob/jetty-9.2.x/advisories/2015-02-24-httpparser-error-buffer-bleed.md
1000013	1	2016-10-06T14:59Z	CVE-2015-1000013	WordPress 用 csv2wpec-coupon プラグインにおけるリモートファイルをアップロードされる脆弱性	http://www.vapidlabs.com/advisory.php?v=153
1000012	1	2016-10-06T14:59Z	CVE-2015-1000012	WordPress 用 mypixs プラグインにおけるローカルファイルインクルードの脆弱性	http://www.vapidlabs.com/advisory.php?v=154
1000011	1	2016-10-06T14:59Z	CVE-2015-1000011	WordPress 用 DukaPress プラグインにおけるブラインド SQL インジェクションの脆弱性	http://www.vapidlabs.com/advisory.php?v=152
1000010	1	2016-10-06T14:59Z	CVE-2015-1000010	WordPress 用 simple-image-manipulator プラグインにおけるファイルをダウンロードされる脆弱性	http://www.vapidlabs.com/advisory.php?v=147
1000009	1	2016-10-06T14:59Z	CVE-2015-1000009	WordPress 用 google-adsense-and-hotel-booking プラグインの Open Proxy における脆弱性	http://www.vapidlabs.com/advisory.php?v=151
1000007	1	2016-10-06T14:59Z	CVE-2015-1000007	WordPress 用 wptf-image-gallery プラグインにおけるファイルをダウンロードされる脆弱性	http://www.vapidlabs.com/advisory.php?v=148
1000004	1	2016-10-06T14:59Z	CVE-2015-1000004	WordPress 用 filedownload プラグインの Open Proxy における脆弱性	http://www.vapidlabs.com/advisory.php?v=140
1000003	1	2016-10-06T14:59Z	CVE-2015-1000003	WordPress 用 filedownload プラグインの Open Proxy における脆弱性	http://www.vapidlabs.com/advisory.php?v=140
1000002	1	2016-10-06T14:59Z	CVE-2015-1000002	WordPress 用 filedownload プラグインの Open Proxy における脆弱性	http://www.vapidlabs.com/advisory.php?v=140
1000001	1	2016-10-06T14:59Z	CVE-2015-1000001	WordPress 用 fast-image-adder プラグインにおけるファイルをアップロードされる脆弱性	http://www.vapidlabs.com/advisory.php?v=139
1000000	1	2016-10-06T14:59Z	CVE-2015-1000000	WordPress 用 MailCWP プラグインにおけるファイルをアップロードされる脆弱性	http://www.vapidlabs.com/advisory.php?v=138
8934	1	2016-09-20T14:15Z	CVE-2015-8934	libarchive の archive_read_support_format_rar.c の copy_from_lzss_window 関数におけるサービス運用妨害 (DoS) の脆弱性	https://github.com/libarchive/libarchive/issues/521
8933	1	2016-09-20T14:15Z	CVE-2015-8933	libarchive の archive_read_support_format_tar.c の archive_read_format_tar_skip 関数における整数オーバーフローの脆弱性	https://github.com/libarchive/libarchive/issues/548
8932	1	2016-09-20T14:15Z	CVE-2015-8932	libarchive の archive_read_support_filter_compress.c の compress_bidder_init 関数におけるサービス運用妨害 (DoS) の脆弱性	https://github.com/libarchive/libarchive/issues/547
8931	1	2016-09-20T14:15Z	CVE-2015-8931	libarchive の archive_read_support_format_mtree.c の get_time_t_max および get_time_t_min 関数における整数オーバーフローの脆弱性	https://github.com/libarchive/libarchive/issues/539
8929	1	2016-09-20T14:15Z	CVE-2015-8929	libarchive の archive_read_extract2.c の __archive_read_get_extract 関数におけるサービス運用妨害 (DoS) の脆弱性	https://github.com/libarchive/libarchive/issues/517
8928	1	2016-09-20T14:15Z	CVE-2015-8928	libarchive の archive_read_support_format_mtree.c の process_add_entry 関数におけるサービス運用妨害 (DoS) の脆弱性	https://github.com/libarchive/libarchive/issues/550
8927	1	2016-09-20T14:15Z	CVE-2015-8927	libarchive の archive_read_support_format_zip.c の trad_enc_decrypt_update 関数におけるサービス運用妨害 (DoS) の脆弱性	https://github.com/libarchive/libarchive/issues/523
8926	1	2016-09-20T14:15Z	CVE-2015-8926	libarchive の archive_read_support_format_rar.c の archive_read_format_rar_read_data 関数におけるサービス運用妨害 (DoS) の脆弱性	https://github.com/libarchive/libarchive/issues/518
8925	1	2016-09-20T14:15Z	CVE-2015-8925	libarchive の archive_read_support_format_mtree.c の readline 関数におけるサービス運用妨害 (DoS) の脆弱性	https://github.com/libarchive/libarchive/issues/516
8915	1	2016-09-20T14:15Z	CVE-2015-8915	libarchive の bsdcpio におけるサービス運用妨害 (DoS) の脆弱性	https://blog.fuzzing-project.org/47-Many-invalid-memory-access-issues-in-libarchive.html
8915	2	2016-09-20T14:15Z	CVE-2015-8915	libarchive の bsdcpio におけるサービス運用妨害 (DoS) の脆弱性	https://github.com/libarchive/libarchive/issues/503
5399	1	2016-08-26T20:59Z	CVE-2015-5399	PHPVibe におけるクロスサイトスクリプティングの脆弱性	https://packetstormsecurity.com/files/132715/phpVibe-Stored-Cross-Site-Scripting.html
5399	2	2016-08-26T20:59Z	CVE-2015-5399	PHPVibe におけるクロスサイトスクリプティングの脆弱性	https://www.exploit-db.com/exploits/37659
8914	1	2016-06-17T15:59Z	CVE-2015-8914	OpenStack Neutron の IPTables ファイアウォールにおける ICMPv6 偽造保護メカニズムを回避される脆弱性	https://bugs.launchpad.net/neutron/+bug/1502933
8879	1	2016-05-22T01:59Z	CVE-2015-8879	PHP の ext/odbc/php_odbc.c の odbc_bindcols 関数におけるサービス運用妨害 (DoS) の脆弱性	https://bugs.php.net/bug.php?id=69975
8877	1	2016-05-22T01:59Z	CVE-2015-8877	PHP で使用される GD Graphics Library の gd_interpolation.c の gdImageScaleTwoPass 関数におけるサービス運用妨害 (DoS) の脆弱性	https://bugs.php.net/bug.php?id=70064
8876	1	2016-05-22T01:59Z	CVE-2015-8876	PHP の Zend/zend_exceptions.c におけるサービス運用妨害 (DoS) の脆弱性	https://bugs.php.net/bug.php?id=70121
8865	1	2016-05-20T10:59Z	CVE-2015-8865	PHP の Fileinfo コンポーネントで使用される file の funcs.c の file_check_mem 関数におけるサービス運用妨害 (DoS) の脆弱性	https://bugs.php.net/bug.php?id=71527
8874	1	2016-05-16T10:59Z	CVE-2015-8874	PHP の GD におけるサービス運用妨害 (DoS) の脆弱性	https://bugs.php.net/bug.php?id=66387
8873	1	2016-05-16T10:59Z	CVE-2015-8873	PHP の Zend/zend_exceptions.c におけるサービス運用妨害 (DoS) の脆弱性	https://bugs.php.net/bug.php?id=69793
6838	1	2016-05-16T10:59Z	CVE-2015-6838	PHP の ext/xsl/xsltprocessor.c の xsl_ext_function_php 関数におけるサービス運用妨害 (DoS) の脆弱性	https://bugs.php.net/bug.php?id=69782
6837	1	2016-05-16T10:59Z	CVE-2015-6837	PHP の ext/xsl/xsltprocessor.c の xsl_ext_function_php 関数におけるサービス運用妨害 (DoS) の脆弱性	https://bugs.php.net/bug.php?id=69782
6835	1	2016-05-16T10:59Z	CVE-2015-6835	PHP のセッションデシリアライザにおける任意のコードを実行される脆弱性	https://bugs.php.net/bug.php?id=70219
6834	1	2016-05-16T10:59Z	CVE-2015-6834	PHP における任意のコードを実行される脆弱性	https://bugs.php.net/bug.php?id=70172
4643	1	2016-05-16T10:59Z	CVE-2015-4643	PHP の ext/ftp/ftp.c の ftp_genlist 関数における整数オーバーフローの脆弱性	https://bugs.php.net/bug.php?id=69545
4642	1	2016-05-16T10:59Z	CVE-2015-4642	Windows 版 PHP における OS コマンドインジェクションの脆弱性	https://bugs.php.net/bug.php?id=69646
4605	1	2016-05-16T10:59Z	CVE-2015-4605	PHP の Fileinfo コンポーネントで使用される file の softmagic.c の mcopy 関数におけるサービス運用妨害 (DoS) の脆弱性	https://bugs.php.net/bug.php?id=68819
4604	1	2016-05-16T10:59Z	CVE-2015-4604	PHP の Fileinfo コンポーネントで使用される file の softmagic.c の mget 関数におけるサービス運用妨害 (DoS) の脆弱性	https://bugs.php.net/bug.php?id=68819
4603	1	2016-05-16T10:59Z	CVE-2015-4603	PHP の Zend/zend_exceptions.c の exception::getTraceAsString 関数における任意のコードを実行される脆弱性	https://bugs.php.net/bug.php?id=69152
4602	1	2016-05-16T10:59Z	CVE-2015-4602	PHP の ext/standard/incomplete_class.c の __PHP_Incomplete_Class 関数におけるサービス運用妨害 (DoS) の脆弱性	https://bugs.php.net/bug.php?id=69152
4600	1	2016-05-16T10:59Z	CVE-2015-4600	PHP の SoapClient の実装におけるサービス運用妨害 (DoS) の脆弱性	https://bugs.php.net/bug.php?id=69152
4599	1	2016-05-16T10:59Z	CVE-2015-4599	PHP の ext/soap/soap.c の SoapFault::__toString メソッドにおける重要な情報を取得される脆弱性	https://bugs.php.net/bug.php?id=69152
4116	1	2016-05-16T10:59Z	CVE-2015-4116	PHP の ext/spl/spl_heap.c の spl_ptr_heap_insert 関数における任意のコードを実行される脆弱性	https://bugs.php.net/bug.php?id=69737
3412	1	2016-05-16T10:59Z	CVE-2015-3412	PHP における任意のファイルを読まれる脆弱性	https://bugs.php.net/bug.php?id=69353
3411	1	2016-05-16T10:59Z	CVE-2015-3411	PHP における任意のファイルを読み書きされる脆弱性	https://bugs.php.net/bug.php?id=69353
6834	2	2016-05-16T10:59Z	CVE-2015-6834	PHP における任意のコードを実行される脆弱性	https://bugs.php.net/bug.php?id=70365
4116	2	2016-05-16T10:59Z	CVE-2015-4116	PHP の ext/spl/spl_heap.c の spl_ptr_heap_insert 関数における任意のコードを実行される脆弱性	https://www.htbridge.com/advisory/HTB23262
6834	3	2016-05-16T10:59Z	CVE-2015-6834	PHP における任意のコードを実行される脆弱性	https://bugs.php.net/bug.php?id=70366
7801	1	2016-04-20T16:59Z	CVE-2015-7801	OptiPNG における任意のコードを実行される脆弱性	http://www.openwall.com/lists/oss-security/2015/09/16/1
7676	1	2016-04-15T15:59Z	CVE-2015-7676	Ipswitch MOVEit File Transfer におけるクロスサイトスクリプティングの脆弱性	http://packetstormsecurity.com/files/135458/Ipswitch-MOVEit-DMZ-8.1-Persistent-Cross-Site-Scripting.html
7676	2	2016-04-15T15:59Z	CVE-2015-7676	Ipswitch MOVEit File Transfer におけるクロスサイトスクリプティングの脆弱性	https://profundis-labs.com/advisories/CVE-2015-7676.txt
1547	1	2016-04-13T17:59Z	CVE-2015-1547	LibTIFF の tif_next.c の NeXTDecode 関数におけるサービス運用妨害 (DoS) の脆弱性	http://openwall.com/lists/oss-security/2015/01/24/16
